{
  "version": "0.2.0",
  "memory": [],
  "task_preferences": {
    "default_priority": 0,
    "telemetry_is_ssot": true
  },
  "work_items": [
    {
      "work_id": "pkt-dome-demo-0001-implement",
      "status": "DONE",
      "node": {
        "reqs": [],
        "deps": [
          "pkt-dome-demo-0001-plan"
        ],
        "provs": [
          "telemetry"
        ],
        "assert": [
          "gate_passes"
        ]
      },
      "telemetry": {
        "otel": {
          "backend": "local-mvp",
          "trace_id_hex": "00000000000000000000000000000000",
          "span_id_hex": "0000000000000000",
          "project": "dome",
          "run_id": "pkt-dome-demo-0001"
        },
        "signals": {
          "task.status": "PASS",
          "task.attempts": 1
        },
        "artifacts": [
          {
            "path": "ops/runtime/runs/pkt-dome-demo-0001/task_results/pkt-dome-demo-0001-implement.result.json",
            "sha256": "2e8de7276c19977f2bf00964be614d01717c315b30310febc2cc883cc8da340c",
            "bytes": 398
          },
          {
            "path": "ops/runtime/runs/pkt-dome-demo-0001/attempts/pkt-dome-demo-0001-implement.attempts.json",
            "sha256": "3876e7f1de46d5d4429b69d2848d064abee451b80f8e55a3cdcb233727a99e3e",
            "bytes": 180
          }
        ]
      },
      "gate": {
        "status": "DONE",
        "reason_code": null,
        "notes": "all deterministic checks passed; trace_source=disabled; verify_rc=0; verify_output=demo verify ok"
      }
    },
    {
      "work_id": "pkt-dome-demo-0001-plan",
      "status": "DONE",
      "node": {
        "reqs": [],
        "deps": [],
        "provs": [
          "telemetry"
        ],
        "assert": [
          "gate_passes"
        ]
      },
      "telemetry": {
        "otel": {
          "backend": "local-mvp",
          "trace_id_hex": "00000000000000000000000000000000",
          "span_id_hex": "0000000000000000",
          "project": "dome",
          "run_id": "pkt-dome-demo-0001"
        },
        "signals": {
          "task.status": "PASS",
          "task.attempts": 1
        },
        "artifacts": [
          {
            "path": "ops/runtime/runs/pkt-dome-demo-0001/task_results/pkt-dome-demo-0001-plan.result.json",
            "sha256": "b5a8413009f58bbd7a8536c64e7f9267e225b8d79f559d1a658e10438e192861",
            "bytes": 388
          },
          {
            "path": "ops/runtime/runs/pkt-dome-demo-0001/attempts/pkt-dome-demo-0001-plan.attempts.json",
            "sha256": "ba9127e91df2a2eb24e18af14712ade10650d9f609c04f9a63f81a98b6fcc9ab",
            "bytes": 175
          }
        ]
      },
      "gate": {
        "status": "DONE",
        "reason_code": null,
        "notes": "all deterministic checks passed; trace_source=disabled; verify_rc=0; verify_output=demo verify ok"
      }
    },
    {
      "work_id": "pkt-dome-demo-0001-verify",
      "status": "DONE",
      "node": {
        "reqs": [],
        "deps": [
          "pkt-dome-demo-0001-implement"
        ],
        "provs": [
          "telemetry"
        ],
        "assert": [
          "gate_passes"
        ]
      },
      "telemetry": {
        "otel": {
          "backend": "local-mvp",
          "trace_id_hex": "00000000000000000000000000000000",
          "span_id_hex": "0000000000000000",
          "project": "dome",
          "run_id": "pkt-dome-demo-0001"
        },
        "signals": {
          "task.status": "PASS",
          "task.attempts": 1
        },
        "artifacts": [
          {
            "path": "ops/runtime/runs/pkt-dome-demo-0001/task_results/pkt-dome-demo-0001-verify.result.json",
            "sha256": "14ea34d254179af380333c3e2d1acdc4e5a3cc3aff32cfec1aa370ee59556ebb",
            "bytes": 392
          },
          {
            "path": "ops/runtime/runs/pkt-dome-demo-0001/attempts/pkt-dome-demo-0001-verify.attempts.json",
            "sha256": "14f9153b4a87c1e769c241dc17713511f7fbf4b01d1e0570808ea78f60d38898",
            "bytes": 177
          }
        ]
      },
      "gate": {
        "status": "DONE",
        "reason_code": null,
        "notes": "all deterministic checks passed; trace_source=disabled; verify_rc=0; verify_output=demo verify ok"
      }
    }
  ]
}