{
  "version": "0.2.0",
  "memory": [],
  "task_preferences": {
    "default_priority": 0,
    "telemetry_is_ssot": true
  },
  "work_items": [
    {
      "work_id": "pkt-dome-livefix-0001-implement",
      "status": "DONE",
      "node": {
        "reqs": [],
        "deps": [
          "pkt-dome-livefix-0001-plan"
        ],
        "provs": [
          "telemetry"
        ],
        "assert": [
          "gate_passes"
        ]
      },
      "telemetry": {
        "otel": {
          "backend": "local-mvp",
          "trace_id_hex": "00000000000000000000000000000000",
          "span_id_hex": "0000000000000000",
          "project": "dome",
          "run_id": "pkt-dome-livefix-0001"
        },
        "signals": {
          "task.status": "PASS",
          "task.attempts": 2
        },
        "artifacts": [
          {
            "path": "ops/runtime/runs/pkt-dome-livefix-0001/task_results/pkt-dome-livefix-0001-implement.result.json",
            "sha256": "afda40da1613762c70aebe62c308b98c1c59cab9f5512bf34271132a65b23fc5",
            "bytes": 1579
          },
          {
            "path": "ops/runtime/runs/pkt-dome-livefix-0001/attempts/pkt-dome-livefix-0001-implement.attempts.json",
            "sha256": "2cda70c05e83267327f157ebf7cd97f151d21a9bbd1e929b74b7f06dfc07cc55",
            "bytes": 1223
          }
        ]
      },
      "gate": {
        "status": "DONE",
        "reason_code": null,
        "notes": "all deterministic checks passed; trace_source=disabled; verify_rc=0; verify_output=.                                                                        [100%]\n1 passed in 0.01s"
      }
    },
    {
      "work_id": "pkt-dome-livefix-0001-plan",
      "status": "DONE",
      "node": {
        "reqs": [],
        "deps": [],
        "provs": [
          "telemetry"
        ],
        "assert": [
          "gate_passes"
        ]
      },
      "telemetry": {
        "otel": {
          "backend": "local-mvp",
          "trace_id_hex": "00000000000000000000000000000000",
          "span_id_hex": "0000000000000000",
          "project": "dome",
          "run_id": "pkt-dome-livefix-0001"
        },
        "signals": {
          "task.status": "PASS",
          "task.attempts": 1
        },
        "artifacts": [
          {
            "path": "ops/runtime/runs/pkt-dome-livefix-0001/task_results/pkt-dome-livefix-0001-plan.result.json",
            "sha256": "dfe516ab93dd7268126d99b59165636b93ccad4b1301128570c221906c1c69d8",
            "bytes": 1702
          },
          {
            "path": "ops/runtime/runs/pkt-dome-livefix-0001/attempts/pkt-dome-livefix-0001-plan.attempts.json",
            "sha256": "31f9464291fb71392bbbea77db32a45a2b071a5118f74b806c608a40ad78326e",
            "bytes": 832
          }
        ]
      },
      "gate": {
        "status": "DONE",
        "reason_code": null,
        "notes": "all deterministic checks passed; trace_source=disabled; verify_rc=0; verify_output=.                                                                        [100%]\n1 passed in 0.01s"
      }
    },
    {
      "work_id": "pkt-dome-livefix-0001-verify",
      "status": "DONE",
      "node": {
        "reqs": [],
        "deps": [
          "pkt-dome-livefix-0001-implement"
        ],
        "provs": [
          "telemetry"
        ],
        "assert": [
          "gate_passes"
        ]
      },
      "telemetry": {
        "otel": {
          "backend": "local-mvp",
          "trace_id_hex": "00000000000000000000000000000000",
          "span_id_hex": "0000000000000000",
          "project": "dome",
          "run_id": "pkt-dome-livefix-0001"
        },
        "signals": {
          "task.status": "PASS",
          "task.attempts": 1
        },
        "artifacts": [
          {
            "path": "ops/runtime/runs/pkt-dome-livefix-0001/task_results/pkt-dome-livefix-0001-verify.result.json",
            "sha256": "8b1574b5fb633015250263e694d124a7f541b49243e6cecf0b7436593f15161e",
            "bytes": 574
          },
          {
            "path": "ops/runtime/runs/pkt-dome-livefix-0001/attempts/pkt-dome-livefix-0001-verify.attempts.json",
            "sha256": "3ee362fc909f3e38cbe458e974917406f5c36b60cb012e38462bb9af3bb9dd5c",
            "bytes": 268
          }
        ]
      },
      "gate": {
        "status": "DONE",
        "reason_code": null,
        "notes": "all deterministic checks passed; trace_source=disabled; verify_rc=0; verify_output=.                                                                        [100%]\n1 passed in 0.01s"
      }
    }
  ]
}