{
  "version": "0.2.0",
  "memory": [],
  "task_preferences": {
    "default_priority": 0,
    "telemetry_is_ssot": true
  },
  "work_items": [
    {
      "work_id": "pkt-dome-demo-0001-plan",
      "status": "DONE",
      "node": {
        "reqs": [],
        "deps": [],
        "provs": [
          "telemetry"
        ],
        "assert": [
          "gate_passes"
        ]
      },
      "telemetry": {
        "otel": {
          "backend": "local-mvp",
          "trace_id_hex": "00000000000000000000000000000000",
          "span_id_hex": "0000000000000000",
          "project": "dome",
          "run_id": "pkt-dome-demo-0001"
        },
        "signals": {
          "run.id": "pkt-dome-demo-0001",
          "task.id": "pkt-dome-demo-0001-plan",
          "task.status": "PASS",
          "task.attempts": 1,
          "task.retry_backoff_ms": 0,
          "task.notes": "implementer synthetic worker result",
          "task.reason_code": null,
          "task.worker_model": "gpt-5.3",
          "task.duration_ms": 0
        },
        "artifacts": [
          {
            "path": "ops/runtime/runs/pkt-dome-demo-0001/task_results/pkt-dome-demo-0001-plan.result.json",
            "sha256": "b89aeeca47d31953abf1add63b8fbc9e419ef10c9fe01c0de3654f520488682b",
            "bytes": 459
          },
          {
            "path": "ops/runtime/runs/pkt-dome-demo-0001/attempts/pkt-dome-demo-0001-plan.attempts.json",
            "sha256": "ddddb430784b08d5da9bdeaa02b83344277d868683361c4cc7ef94df25ded077",
            "bytes": 198
          }
        ]
      },
      "gate": {
        "status": "DONE",
        "reason_code": null,
        "notes": "all deterministic checks passed; trace_source=disabled; verify_rc=0; verify_output=demo verify ok"
      }
    },
    {
      "work_id": "pkt-dome-demo-0001-implement",
      "status": "DONE",
      "node": {
        "reqs": [],
        "deps": [
          "pkt-dome-demo-0001-plan"
        ],
        "provs": [
          "telemetry"
        ],
        "assert": [
          "gate_passes"
        ]
      },
      "telemetry": {
        "otel": {
          "backend": "local-mvp",
          "trace_id_hex": "00000000000000000000000000000000",
          "span_id_hex": "0000000000000000",
          "project": "dome",
          "run_id": "pkt-dome-demo-0001"
        },
        "signals": {
          "run.id": "pkt-dome-demo-0001",
          "task.id": "pkt-dome-demo-0001-implement",
          "task.status": "PASS",
          "task.attempts": 1,
          "task.retry_backoff_ms": 0,
          "task.notes": "implementer synthetic worker result",
          "task.reason_code": null,
          "task.worker_model": "gpt-5.2",
          "task.duration_ms": 0
        },
        "artifacts": [
          {
            "path": "ops/runtime/runs/pkt-dome-demo-0001/task_results/pkt-dome-demo-0001-implement.result.json",
            "sha256": "dbfa7dbbcdb85746a1ec6cf3c099d5bc8b6cf1d273de63f2fdd8eb02f5fd67d9",
            "bytes": 469
          },
          {
            "path": "ops/runtime/runs/pkt-dome-demo-0001/attempts/pkt-dome-demo-0001-implement.attempts.json",
            "sha256": "5c24b2fcdaf60bc3c055e341b3e5413a3dda727b4410df10a3344b991750d01f",
            "bytes": 203
          }
        ]
      },
      "gate": {
        "status": "DONE",
        "reason_code": null,
        "notes": "all deterministic checks passed; trace_source=disabled; verify_rc=0; verify_output=demo verify ok"
      }
    },
    {
      "work_id": "pkt-dome-demo-0001-verify",
      "status": "DONE",
      "node": {
        "reqs": [],
        "deps": [
          "pkt-dome-demo-0001-implement"
        ],
        "provs": [
          "telemetry"
        ],
        "assert": [
          "gate_passes"
        ]
      },
      "telemetry": {
        "otel": {
          "backend": "local-mvp",
          "trace_id_hex": "00000000000000000000000000000000",
          "span_id_hex": "0000000000000000",
          "project": "dome",
          "run_id": "pkt-dome-demo-0001"
        },
        "signals": {
          "run.id": "pkt-dome-demo-0001",
          "task.id": "pkt-dome-demo-0001-verify",
          "task.status": "PASS",
          "task.attempts": 1,
          "task.retry_backoff_ms": 0,
          "task.notes": "implementer synthetic worker result",
          "task.reason_code": null,
          "task.worker_model": "gpt-5.3",
          "task.duration_ms": 0
        },
        "artifacts": [
          {
            "path": "ops/runtime/runs/pkt-dome-demo-0001/task_results/pkt-dome-demo-0001-verify.result.json",
            "sha256": "49a8f48222705d06473c7cbf8ffc9b5d5f9f480051398eec03ba68c51ebff4a2",
            "bytes": 463
          },
          {
            "path": "ops/runtime/runs/pkt-dome-demo-0001/attempts/pkt-dome-demo-0001-verify.attempts.json",
            "sha256": "68aec4e6d815d98073bed1f8d49b5c0c251d914f557c8fc91c0251de2c5249ea",
            "bytes": 200
          }
        ]
      },
      "gate": {
        "status": "DONE",
        "reason_code": null,
        "notes": "all deterministic checks passed; trace_source=disabled; verify_rc=0; verify_output=demo verify ok"
      }
    }
  ]
}
